{
 "Schema": "a7-designation/3",
 "Case": "N7B",
 "Repo": "D:/r62-a6m7/bench/c-n7",
 "AuthorityRevision": "1746b404e57d69170ecfc084fd24fa3e699916d7",
 "Invocation": {
  "UnitId": "FX-U1",
  "TaskId": "T1",
  "Attempt": 0,
  "RunId": "R20261016T000000Z-m7b7",
  "Target": {
   "Commit": "b417d36cb820a27c78d6c7d50c234460469c89f8",
   "Path": "src/Fixture.Lib/Calculator.cs",
   "Blob": "380892ee869194aa4bd56dcf32dfd76ef0203ab9"
  },
  "Kind": "VERIFY"
 },
 "RunPath": "artifacts/orchestration/FX-U1/T1/0/R20261016T000000Z-m7b7/",
 "Instrument": {
  "Path": "docs/automation/evidence/I-62-F6/FX-02/bmin/tool/bmin_facts.py",
  "Blob": "9a829b0eeb1210238052b1feac06cfa8f7964aed"
 },
 "MapPath": "docs/automation/agent-execution/compatibility/I62-clause-map.json",
 "Adapter": "codex-cli",
 "Artifacts": [
  {
   "Role": "DELEG",
   "Path": "artifacts/orchestration/FX-U1/T1-n7b/0/R20261012T090000Z-d001/output.json",
   "Blob": "434966c5a2e70d3c228964529fab0ae26eb19152",
   "Custody": "D:/r62-a6m7/bench/work/in-n7b/deleg.json"
  },
  {
   "Role": "H",
   "Path": "artifacts/orchestration/FX-U1/T1-n7b/0/R20261012T091000Z-a001/worker-handoff.json",
   "Blob": "5a79386682365a4168ccc087c04ccd1e5a90abdf",
   "Custody": "D:/r62-a6m7/bench/work/in-n7b/handoff.json"
  },
  {
   "Role": "CONTRACT",
   "Path": "docs/automation/decisions/FX-U1-T1.gate-contract.json",
   "Blob": "628d89af5f21e4e14cbe7c3c14f0dd8fb5a490e0",
   "Custody": null
  },
  {
   "Role": "TRX_CURRENT",
   "Path": "artifacts/ci/R37949808974/fixture-tests.trx",
   "Blob": "40295387f9b489d2bf7ff4e517adc2d99c0d35ff",
   "Custody": "D:/r62-a6m7/bench/work/in-n7b/fixture-tests.trx"
  },
  {
   "Role": "TRX_RED",
   "Path": "artifacts/ci/R37949800001/fixture-tests.trx",
   "Blob": "5fd8860bdd6fe21268faf1b10d0df4d9b4743f92",
   "Custody": "D:/r62-a7/evid-r3/inputs/fixture-tests-red.trx"
  },
  {
   "Role": "RELAY",
   "Path": "artifacts/orchestration/FX-U1/T1/0/R20261016T000000Z-m7b7/relay-facts.json",
   "Blob": "b95a5086500bb2a50786b4ebe52c5d4622143ab8",
   "Custody": "D:/r62-a6m7/bench/work/s-n7b/relay-facts.json"
  }
 ]
}
